{
  "id": "org.streamix.repository.lab",
  "name": "Streamix Lab Local Repository",
  "version": "1.0.0",
  "description": "Reference extension repository for Streamix Desktop extension lab testing",
  "manifestVersion": 1,
  "homepageUrl": "https://github.com/Swagsaiiff/streamix-desktop/tree/main/streamix-extension-lab"
}